{
  "schema_version": 1,
  "seed_only": true,
  "lane": 1,
  "lane_focus": "sleep-stress-mood",
  "research_only": true,
  "pmids": [
    "20569455",
    "42727513",
    "41798036"
  ],
  "relevance_reason": "Source-verified human studies of sleep quality, anxiety, and psychological distress, including a null supplement trial and nonpharmacological comparators; all scientific interpretations remain unreviewed."
}
